object_location,objectid,title,date,date-is-approximate?,creator,recipient,description,item_information,subject,location,latitude,longitude,related_publication,publisher-digital,source,findingaid,original-identifier,identifier,rights,rightsstatement,type,format,language,relation,display_template,image_small,image_thumb
https://digital.ncdcr.gov/Documents/Detail/tar-heel-junior-historian-2007-spring-v.46-no.2/3700448?item=5369774,blackhistory046,Challenging the Chain Stores,1928-1936,y,"Tolbert, Lisa",,Article about the Colored Merchants Association from the Tar Heel Junior Historian,multiple-page; article,"African American business enterprises--North Carolina--Winston-Salem; African American businesspeople; African American men; African Americans; African Americans--Business; African Americans--North Carolina--Winston-Salem--History; Businessmen; Grocery trade
","Winston-Salem, North Carolina; St. Louis, Missouri; San Francisco, California; New York City, New York; Ciaro, Egypt; Ghana, Africa",36.099861,-80.244217,,State Library of North Carolina,North Carolina Department of Natural and Cultural Resources,,,pubs_serial_6740319_tar2007v46n2,"Users are responsible for determining the legal status of and securing any permissions necessary to distribute, reproduce, or make other use of this item.",https://digital.ncdcr.gov/about#copyright-and-use-restrictions-simple-rich-text-area,Text,text/html,eng,,pdf,/objects/small/046_coloredmerchants_sm.jpg,/objects/thumbs/046_coloredmerchants_th.jpg
https://www.ncpedia.org/national-negro-business-league,blackhistory047,National Negro Business League,1900-,y,"Kenzer, Robert C.",,Article about the National Negro Business League,single-page; article,African American business enterprises--North Carolina--Winston-Salem; African American businesspeople; African American men; African Americans; African Americans--Business; African Americans--North Carolina--Winston-Salem--History; Businessmen; Grocery trade,"North Carolina, United States",,,,NCpedia,State Library of NC.,,,/node/51819,"NCpedia content has been made available by contributors for personal educational use, consistent with provisions of fair use under copyright law. For any other uses, derivatives or republication requests, please contact the individual contributors or publishers.",https://www.ncpedia.org/writing-and-citing-ncpedia-articles,Text,text/html,eng,,pdf,/objects/small/047_nationalnegrobusiness_sm.jpg,/objects/thumbs/047_nationalnegrobusiness_th.jpg
https://www.ncpedia.org/north-carolina-mutual-life-insuranc,blackhistory048,North Carolina Mutual Life Insurance Company,1899-,n,"Barfield, Rodney D. and John F. Ansley",,Article about the NC Mutucal Life Insurance Company,single-page; article,African American business enterprises--North Carolina--Durham; African American businesspeople--North Carolina--Durham; African Americans--Business; African Americans--North Carolina--Durham--History; Durham (N.C.); Industries--North Carolina--Durham; Insurance companies--North Carolina--Durham; North Carolina Mutual Life Insurance Company,"Durham, North Carolina",35.994034,-78.898621,,NCpedia,State Library of NC.,,,/node/51899,"NCpedia content has been made available by contributors for personal educational use, consistent with provisions of fair use under copyright law. For any other uses, derivatives or republication requests, please contact the individual contributors or publishers.",https://www.ncpedia.org/writing-and-citing-ncpedia-articles,Text,text/html,eng,,pdf,/objects/small/048_ncmutuallife_sm.jpg,/objects/thumbs/048_ncmutuallife_th.jpg
https://www.ncpedia.org/black-wall-street-durham-north-carolina,blackhistory049,"Black Wall Street, Durham, North Carolina",1906-1960s,y,"Hill, Michael",,Article about Parrish Street in Durham.,single-page; article,African American business enterprises--North Carolina--Durham; African American businesspeople--North Carolina--Durham; African Americans--Business; African Americans--North Carolina--Durham--History; Durham (N.C.); Industries--North Carolina--Durham,"Durham, North Carolina",35.99496,-78.89906,,NCpedia,State Library of NC.,,,/node/53499,"NCpedia content has been made available by contributors for personal educational use, consistent with provisions of fair use under copyright law. For any other uses, derivatives or republication requests, please contact the individual contributors or publishers.",https://www.ncpedia.org/writing-and-citing-ncpedia-articles,Text,text/html,eng,,pdf,/objects/small/049_blackwallstreet_sm.jpg,/objects/thumbs/049_blackwallstreet_th.jpg
https://www.ncpedia.org/african-americans/introduction,blackhistory050,African American People in North Carolina,1663-,y,"Alexander, Roberta Sue, Rodney D. Barfield, and Steven E. Nash",,Multi-part article about African Americans in North Carolina,single-page; article,African Americans; Enslaved persons--Emancipation; Enslaved persons--Emancipation--North Carolina; Enslaved persons--Emancipation--United States; Enslaved persons--Emancipation; Enslaved persons--Emancipation--North Carolina; Enslaved persons--Emancipation--United States,"North Carolina, United States",,,,NCpedia,State Library of NC.,,,/node/52537,"NCpedia content has been made available by contributors for personal educational use, consistent with provisions of fair use under copyright law. For any other uses, derivatives or republication requests, please contact the individual contributors or publishers.",https://www.ncpedia.org/writing-and-citing-ncpedia-articles,Text,text/html,eng,,pdf,/objects/small/050_africanamerican_sm.jpg,/objects/thumbs/050_africanamerican_th.jpg
https://www.ncpedia.org/freedmens-conventions,blackhistory051,Freedmen's Conventions,1865-1866,y,"Jones, H.G.",,Article about Freedmen's Conventions,single-page; article,African American history; African American men; African Americans; African Americans--History--1863-1877; Conventions; Freedmen; Freedmen--United States--19th century,"Raleigh, North Carolina",35.781547,-78.645536,,NCpedia,State Library of NC.,,,/node/51398,"NCpedia content has been made available by contributors for personal educational use, consistent with provisions of fair use under copyright law. For any other uses, derivatives or republication requests, please contact the individual contributors or publishers.",https://www.ncpedia.org/writing-and-citing-ncpedia-articles,Text,text/html,eng,,pdf,/objects/small/051_freedmensconvention_sm.jpg,/objects/thumbs/051_freedmensconvention_th.jpg
https://digital.ncdcr.gov/Documents/Detail/tar-heel-junior-historian-2008-fall-v.48-no.1/3700444?item=5370137,blackhistory052,African American Political Pioneers,1868,n,"Ijames, Earl",,Article about the Black Caucus of the Constitutional Convention of 1868 from the Tar Heel Junior Historian,multiple-page; article,"African American legislators; African American men; African Americans; African Americans--History--1863-1877; African Americans--North Carolina--History; African Americans--Politics and government; Constitutional conventions; Constitutional conventions--North Carolina; Free African Americans--North Carolina--History--19th century; North Carolina--History, African Americansl ","Raleigh, North Carolina",35.787743,-78.644257,,State Library of North Carolina,North Carolina Department of Natural and Cultural Resources,,,pubs_serial_6740319_tar2008v48n1,"Users are responsible for determining the legal status of and securing any permissions necessary to distribute, reproduce, or make other use of this item.",https://digital.ncdcr.gov/about#copyright-and-use-restrictions-simple-rich-text-area,Text,text/html,eng,,pdf,/objects/small/052_constconvention_sm.jpg,/objects/thumbs/052_constconvention_th.jpg
https://www.ncpedia.org/african-american-dance-ensemble,blackhistory053,African American Dance Ensemble,1984-,y,"Pertalion, Patricia L.",,Article about the African American Dance Ensemble in Durham,single-page; article,African American; African Americans--Race identity; Dance,"Durham, North Carolina",35.994034,-78.898621,,NCpedia,State Library of NC.,,,/node/50752,"NCpedia content has been made available by contributors for personal educational use, consistent with provisions of fair use under copyright law. For any other uses, derivatives or republication requests, please contact the individual contributors or publishers.",https://www.ncpedia.org/writing-and-citing-ncpedia-articles,Text,text/html,eng,,pdf,/objects/small/053_africanamericandance_sm.jpg,/objects/thumbs/053_africanamericandance_th.jpg
https://digital.ncdcr.gov/Documents/Detail/tar-heel-junior-historian-2002-spring-v.41-no.2/3700434?item=5369283,blackhistory054,African and African American Storytelling,,,"Wilson, Madafo Lloyd",,Article about the importance of stories in African American culture,multiple-page; article,African American; African American heritage; African American history; African American oral tradition--North Carolina; African Americans; African Americans--Folklore; African Americans--Folklore--African influences; African Americans--Race identity; Folk tales--African American,Africa; United States,,,,State Library of North Carolina,North Carolina Department of Natural and Cultural Resources,,,pubs_serial_6740319_tar2002v41n2,"Users are responsible for determining the legal status of and securing any permissions necessary to distribute, reproduce, or make other use of this item.",https://digital.ncdcr.gov/about#copyright-and-use-restrictions-simple-rich-text-area,Text,text/html,eng,,pdf,/objects/small/054_aa_stories_sm.jpg,/objects/thumbs/054_aa_stories_th.jpg
https://digital.ncdcr.gov/Documents/Detail/tar-heel-junior-historian-2002-spring-v.41-no.2/3700434?item=5369268,blackhistory055,North Carolina Stories and Storytellers,,,"Jones, Ron",,Article about stories and storytellers featuring a video of North Carolina native Jackie Torrence from the Tar Heel Junior Historian,multiple-page; article,African American heritage; African American oral tradition--North Carolina; African American women; African American women--Biography; African Americans and libraries; African Americans--Biography; African Americans--Folklore; African Americans--Folklore--Southern States; Folklore; Folklore and history--North Carolina; Folklorists; Folk tales--African American; North Carolina--Folklore,"North Carolina, United States",,,,State Library of North Carolina,North Carolina Department of Natural and Cultural Resources,,,pubs_serial_6740319_tar2002v41n2,"Users are responsible for determining the legal status of and securing any permissions necessary to distribute, reproduce, or make other use of this item.",https://digital.ncdcr.gov/about#copyright-and-use-restrictions-simple-rich-text-area,Text,text/html,eng,,pdf,/objects/small/055_nc_storytellers_sm.jpg,/objects/thumbs/055_nc_storytellers_th.jpg
https://www.ncpedia.org/religion/african-methodist-episcopal-zion-church,blackhistory056,African Methodist Episcopal Zion Church,1796-,y,"Williams, Wiley J.",,Article about the AME church,single-page; article,African American churches; African Americans; African Americans--Religion,"North Carolina, United States",,,,NCpedia,State Library of NC.,,,/node/50755,"NCpedia content has been made available by contributors for personal educational use, consistent with provisions of fair use under copyright law. For any other uses, derivatives or republication requests, please contact the individual contributors or publishers.",https://www.ncpedia.org/writing-and-citing-ncpedia-articles,Text,text/html,eng,,pdf,/objects/small/056_amechurch_sm.jpg,/objects/thumbs/056_amechurch_th.jpg
https://www.ncpedia.org/rosenwald-fund,blackhistory057,Rosenwald Fund,1917-1948,y,"Johnson, K. Todd",,Article about the Rosewald Fund,single-page; article,African Americans--Education; African Americans--Education--North Carolina; Education--North Carolina; Julius Rosenwald Fund; North Carolina--Education; Rosenwald schools; Rosenwald schools--North Carolina; Schools,"Chapel Hill, North Carolina; Chicago, Illinois",,,,NCpedia,State Library of NC.,,,/node/52124,"NCpedia content has been made available by contributors for personal educational use, consistent with provisions of fair use under copyright law. For any other uses, derivatives or republication requests, please contact the individual contributors or publishers.",https://www.ncpedia.org/writing-and-citing-ncpedia-articles,Text,text/html,eng,,pdf,/objects/small/057_rosenwald_sm.jpg,/objects/thumbs/057_rosenwald_th.jpg
https://www.ncpedia.org/greensboro-four,blackhistory058,"Greensboro Four: David Richmond, Franklin McCain, Ezell Blair Jr. (Jibreel Khazan), Joe McNeil",1960-02-01,n,"Huaman, Jaime",,Article about the Greensboro Four,single-page; article,African American men; African American universities and colleges; African Americans; African Americans--Civil rights--History--20th century; African Americans--North Carolina--History; Civic participation: working for civil rights; Civil rights demonstrations--North Carolina--Greensboro; Civil rights movements--North Carolina--History--20th century,"Greensboro, North Carolina",36.072116,-79.790407,,NCpedia,State Library of NC.,,,/node/53799,"NCpedia content has been made available by contributors for personal educational use, consistent with provisions of fair use under copyright law. For any other uses, derivatives or republication requests, please contact the individual contributors or publishers.",https://www.ncpedia.org/writing-and-citing-ncpedia-articles,Text,text/html,eng,,pdf,/objects/small/058_greensborofour_sm.jpg,/objects/thumbs/058_greensborofour_th.jpg
https://ncpedia.org/biography/cooper-anna-julia-haywood,blackhistory059,"Cooper, Anna Julia",1858-1864,y,"Wegner, Ansley Herring",,Article about Anna Julia Cooper,single-page; article,African American authors; African American teachers; African American women; African American women--Biography; African American women teachers--Study and teaching--North Carolina; African Americans--Biography; African Americans--Folklore; African Americans--Folklore--Southern States; Feminists; Folklore; Women authors; Women teachers--United States,"Raleigh, North Carolina; Oberlin, Ohio; Washington, District of Columbia, United States",,,,NCpedia,State Library of NC.,,,/node/53539,"NCpedia content has been made available by contributors for personal educational use, consistent with provisions of fair use under copyright law. For any other uses, derivatives or republication requests, please contact the individual contributors or publishers.",https://www.ncpedia.org/writing-and-citing-ncpedia-articles,Text,text/html,eng,,pdf,/objects/small/059_annacooper_sm.jpg,/objects/thumbs/059_annacooper_th.jpg
https://ncpedia.org/north-carolina-freedom-park,blackhistory060,North Carolina Freedom Park,2023-06,n,"Bond, Mattison",,"Article about the Freedom Park in Raleigh, NC.",single-page; article,"African Americans; African American architects; African American history; African Americans; African Americans--History--North Carolina; African Americans--United States--History; North Carolina--History, African Americans; North Carolina Freedom Park (Raleigh, N.C.); Parks; Parks--North Carolina--Planning; Parks--North Carolina--Raleigh","Raleigh, North Carolina",35.783646,-78.637528,,NCpedia,State Library of NC.,,,/node/53137,"NCpedia content has been made available by contributors for personal educational use, consistent with provisions of fair use under copyright law. For any other uses, derivatives or republication requests, please contact the individual contributors or publishers.",https://www.ncpedia.org/writing-and-citing-ncpedia-articles,Text,text/html,eng,,pdf,/objects/small/060_freedompark_sm.jpg,/objects/thumbs/060_freedompark_th.jpg
https://www.ncpedia.org/simone-nina,blackhistory061,"Simone, Nina",1933-2003,y,"Franke, Matthew",,Article about musician Nina Simone,single-page; article,African American musicians; African American women; African American women--Biography; African Americans--Biography; African Americans--North Carolina; African Americans--Women musicians; Music; Musicians--North Carolina,"Tryon, North Carolina; Philadelphia, Pennsylvania; Switzerland; Carry-le-Rouet, France ",,,,NCpedia,State Library of NC.,,,/node/53652,"NCpedia content has been made available by contributors for personal educational use, consistent with provisions of fair use under copyright law. For any other uses, derivatives or republication requests, please contact the individual contributors or publishers.",https://www.ncpedia.org/writing-and-citing-ncpedia-articles,Text,text/html,eng,,pdf,/objects/small/061_ninasimone_sm.jpg,/objects/thumbs/061_ninasimone_th.jpg
https://www.ncpedia.org/Biography/angelou-maya,blackhistory062,Maya Angelou,1928-2014,y,"Horton, Emily; Agan, Kelly",,Article about Maya Angelou,single-page; article,African American authors; African American musicians; African American women; African American women artists; African American women--Biography; African Americans--Biography; African Americans--Civil rights; African Americans--Civil rights--History--20th century; Civic participation: working for civil rights; Civil rights movement; Women authors,"Winston-Salem, North Carolina; St. Louis, Missouri; San Francisco, California; New York City, New York; Ciaro, Egypt; Ghana, Africa",,,,NCpedia,State Library of NC.,,,/node/53698,"NCpedia content has been made available by contributors for personal educational use, consistent with provisions of fair use under copyright law. For any other uses, derivatives or republication requests, please contact the individual contributors or publishers.",https://www.ncpedia.org/writing-and-citing-ncpedia-articles,Text,text/html,eng,,pdf,/objects/small/062_mayaangelou_sm.jpg,/objects/thumbs/062_mayaangelou_th.jpg
https://www.ncpedia.org/biography/chavis-john,blackhistory063,"Chavis, John",1763-1838,y,"Parramore, Barbara M.",,Article about John Chavis,single-page; article,"African American men; African American soldiers--History; African American teachers; African Americans--Biography; African Americans--Education (Higher); African Americans--Educators; Black people--Education--North Carolina; Education -- North Carolina -- History; Education, Higher; Educators--North Carolina","Virginia, United States; Raleigh, North Carolina",,,,NCpedia,State Library of NC.,,,/node/50462,"NCpedia content has been made available by contributors for personal educational use, consistent with provisions of fair use under copyright law. For any other uses, derivatives or republication requests, please contact the individual contributors or publishers.",https://www.ncpedia.org/writing-and-citing-ncpedia-articles,Text,text/html,eng,,pdf,/objects/small/063_johnchavis_sm.jpg,/objects/thumbs/063_johnchavis_th.jpg
https://www.ncpedia.org/j-cole,blackhistory064,J. Cole,1985-,y,"Eckard, Max",,Article about musician J. Cole,single-page; article,African American men; African American musicians; African Americans--Biography; Musicians; Musicians--North Carolina; Music--Performance; African American musicians,"Fayetteville, North Carolina; Queens, New York",,,,NCpedia,State Library of NC.,,,/node/53656,"NCpedia content has been made available by contributors for personal educational use, consistent with provisions of fair use under copyright law. For any other uses, derivatives or republication requests, please contact the individual contributors or publishers.",https://www.ncpedia.org/writing-and-citing-ncpedia-articles,Text,text/html,eng,,pdf,/objects/small/064_jcole_sm.jpg,/objects/thumbs/064_jcole_th.jpg
https://www.ncpedia.org/biography/manly-alex,blackhistory065,Alex Manly,1866-1944,y,"Umfleet, LeRae; Hill, Michael",,Article about Alex Manly,single-page; article,African American businesspeople; African American men; African Americans; African Americans--Business; African Americans--History--1877-1964; African Americans--History--North Carolina; African Americans--North Carolina; African Americans--North Carolina--History--19th Century; African Americans--North Carolina--Wilmington--History; American newspapers--North Carolina; Newspaper editors--Biography; Newspaper publishing--North Carolina--Wilmington,"Raleigh, North Carolina; Wilmington, North Carolina",,,,NCpedia,State Library of NC.,,,/node/53908,"NCpedia content has been made available by contributors for personal educational use, consistent with provisions of fair use under copyright law. For any other uses, derivatives or republication requests, please contact the individual contributors or publishers.",https://www.ncpedia.org/writing-and-citing-ncpedia-articles,Text,text/html,eng,,pdf,/objects/small/065_alexmanly_sm.jpg,/objects/thumbs/065_alexmanly_th.jpg
https://www.ncpedia.org/scott-armond-wendell,blackhistory066,"Scott, Armond Wendell",1873-1960,y,"Smythe, Andrea",,"Article about Judge Armond Wendell Scott, a native of Wilmington, NC.",single-page; article,African American men; African Americans;  African Americans--History--1877-1964; African Americans--History--North Carolina; African Americans--North Carolina; African Americans--North Carolina--History--19th Century; African Americans--North Carolina--Wilmington--History; Judges; Judges--United States--Biography; United States. District Court--Judges,"Wilmington, North Carolina; Washington, District of Columbia, United States; Pennsylvania, United States; New York City, New York",,,,NCpedia,State Library of NC.,,,/node/54109,"NCpedia content has been made available by contributors for personal educational use, consistent with provisions of fair use under copyright law. For any other uses, derivatives or republication requests, please contact the individual contributors or publishers.",https://www.ncpedia.org/writing-and-citing-ncpedia-articles,Text,text/html,eng,,pdf,/objects/small/066_armond_scott_sm.jpg,/objects/thumbs/066_armond_scott_th.jpg
https://www.ncpedia.org/biography/okelly-berry,blackhistory067,"O'Kelly, Berry",1861-1931,y,"Murray, Elizabeth Davis Reid;Dease, Jared",,Article about businessman Berry O'Kelly,single-page; article,"African American businesspeople; African American men; African Americans--Biography; African Americans--Business; African Americans--North Carolina; African Americans--North Carolina--Raleigh--History--1877-1964; Free African Americans--North Carolina--History--19th century; North Carolina--History, African Americans","Raleigh, North Carolina",35.787743,-78.644257,,NCpedia,State Library of NC.,,,/node/48759,"NCpedia content has been made available by contributors for personal educational use, consistent with provisions of fair use under copyright law. For any other uses, derivatives or republication requests, please contact the individual contributors or publishers.",https://www.ncpedia.org/writing-and-citing-ncpedia-articles,Text,text/html,eng,,pdf,/objects/small/067_berry_okelly_sm.jpg,/objects/thumbs/067_berry_okelly_th.jpg
https://www.ncpedia.org/biography/chesnutt-charles-waddell,blackhistory068,"Chesnutt, Charles Waddell",1858-1932,y,"Andrews, William L.",,Article about author Charles Chesnutt,single-page; article,African American authors; African American men; African Americans--Biography; African Americans--Race identity; African Americans--Social conditions; African Americans--United States--History; Authors; Free blacks; Lawyer; Lawyers--Biography,"Cleveland, Ohio; Charlotte, North Carolina",,,,NCpedia,State Library of NC.,,,/node/50468,"NCpedia content has been made available by contributors for personal educational use, consistent with provisions of fair use under copyright law. For any other uses, derivatives or republication requests, please contact the individual contributors or publishers.",https://www.ncpedia.org/writing-and-citing-ncpedia-articles,Text,text/html,eng,,pdf,/objects/small/068_charles_chesnutt_sm.jpg,/objects/thumbs/068_charles_chesnutt_th.jpg
https://www.ncpedia.org/charlotte-hawkins-brown-k-8,blackhistory069,"Brown, Charlotte Hawkins",1883-1961,y,"Ashley, Stephen; Agan, Kelly",,Article about Charlotte Hawkins Brown,single-page; article,"African American teachers; African Americans--Biography; African Americans--Educators; Black people--Education--North Carolina; Brown, Charlotte Hawkins, 1883-1961; Charlotte Hawkins Brown Memorial (Sedalia, N.C.); Education -- North Carolina -- History; Educators--North Carolina; Palmer Memorial Institute (Sedalia, N.C.)","Henderson, North Carolina; Cambridge, Massachusetts; Sedalia, North Carolina",,,,NCpedia,State Library of NC.,,,/node/53181,"NCpedia content has been made available by contributors for personal educational use, consistent with provisions of fair use under copyright law. For any other uses, derivatives or republication requests, please contact the individual contributors or publishers.",https://www.ncpedia.org/writing-and-citing-ncpedia-articles,Text,text/html,eng,,pdf,/objects/small/069_charlottehawkinsbrown_sm.jpg,/objects/thumbs/069_charlottehawkinsbrown_th.jpg
https://www.ncpedia.org/biography/revels,blackhistory070,Hiram Rhoades Revels,1827-1901,y,"Case, Steven",,Article about North Carolina businessman Hiram Revels,single-page; article,"African American legislators; African American men; African Americans--Biography; Politicians; United States--History--Civil War, 1861-1865--African Americans","Fayetteville, North Carolina; Lincolnton, North Carolina; Baltimore, Maryland; St. Louis, Missouri; Natchez, Mississippi",,,,NCpedia,State Library of NC.,,,/node/53902,"NCpedia content has been made available by contributors for personal educational use, consistent with provisions of fair use under copyright law. For any other uses, derivatives or republication requests, please contact the individual contributors or publishers.",https://www.ncpedia.org/writing-and-citing-ncpedia-articles,Text,text/html,eng,,pdf,/objects/small/070_hiramrevels_sm.jpg,/objects/thumbs/070_hiramrevels_th.jpg
