object_location,objectid,title,date,date-is-approximate?,creator,recipient,description,item_information,subject,location,latitude,longitude,related_publication,publisher-digital,source,findingaid,original-identifier,identifier,rights,rightsstatement,type,format,language,relation,display_template,image_small,image_thumb
https://digital.ncdcr.gov/Documents/Detail/tar-heel-junior-historian-1995-fall-v.35-no.1/3700413?item=5368682,blackhistory024,African American Life in North Carolina from the Tar Heel Junior Historian,1995,n,"Crow, Jeffrey J.; Gavins, Raymond",,An article about the history of African Americans in North Carolina,multiple-page; article,"North Carolina--History--Periodicals; North Carolina--History--Societies, etc.--Periodicals","North Carolina, United States",,,,State Library of North Carolina,Tar Heel Junior Historian Association. North Carolina Museum of History.,,F1 16:35/1,pubs_serial_6740319_tar1995v35n1,"Users are responsible for determining the legal status of and securing any permissions necessary to distribute, reproduce, or make other use of this item.",https://digital.ncdcr.gov/about#copyright-and-use-restrictions-simple-rich-text-area,Text,text/html,eng,,pdf,/objects/small/024_aalifeinnc_sm.jpg,/objects/thumbs/024_aalifeinnc_th.jpg
https://digital.ncdcr.gov/Documents/Detail/tar-heel-junior-historian-2004-fall-v.44-no.1/3700456?item=5369477,blackhistory025,African American Civil Rights in North Carolina from the Tar Heel Junior Historian,,,"Brown, Dr. Flora Bryant",,An article about the civil rights of African Americans in North Carolina,multiple-page; article,"North Carolina--History--Periodicals; North Carolina--History--Societies, etc.--Periodicals","North Carolina, United States",,,,State Library of North Carolina,Tar Heel Junior Historian Association. North Carolina Museum of History.,,F1 16:44/1,pubs_serial_6740319_tar2004v44n1,"Users are responsible for determining the legal status of and securing any permissions necessary to distribute, reproduce, or make other use of this item.",https://digital.ncdcr.gov/about#copyright-and-use-restrictions-simple-rich-text-area,Text,text/html,eng,,pdf,/objects/small/025_aacivilrightsnc_sm.jpg,/objects/thumbs/025_aacivilrightsnc_th.jpg
https://digital.ncdcr.gov/Documents/Detail/tar-heel-junior-historian-2013-spring-v.52-no.2/5715024?item=5717184,blackhistory026,Student Non-Violent Coordinating Committee from Tar Heel Junior Historian,1960-1966,y,"Bell-Kite, Diana",,An article about the Student Non-Violent Coordinating Committee.,multiple-page; article,"North Carolina--History--Periodicals; North Carolina--History--Societies, etc.--Periodicals","North Carolina, United States",,,,State Library of North Carolina,State Library of NC. North Carolina Museum of History.,,F1 16:52/2,pubs_serial_6740319_tar2013springv52n2,"Users are responsible for determining the legal status of and securing any permissions necessary to distribute, reproduce, or make other use of this item.",https://digital.ncdcr.gov/about#copyright-and-use-restrictions-simple-rich-text-area,Text,text/html,eng,,pdf,/objects/small/026_sncc_sm.jpg,/objects/thumbs/026_sncc_th.jpg
https://digital.ncdcr.gov/Documents/Detail/african-american-men-walking-down-a-street-carrying-a-banner-reading-freedom-for-all-people/271342,blackhistory027,"African American men walking down a street carrying a banner reading ""Freedom for all People!""",1963,n,"News and observer (Raleigh, N.C.)",,"African American men walking down a street carrying a banner reading ""Freedom for all People!""",single-page; photograph,African Americans--Civil rights; Civil rights demonstrations--North Carolina; Civil rights movements--North Carolina--History--20th century; North Carolina--Race relations--History--20th century; North Carolina--Social conditions--20th century,,,,,State Archives of North Carolina,News and Observer Photograph Collection. Audio Visual Materials. State Archives of North Carolina,,,NO_4_15_1963_NegroesPicket_Fr42,Image copyright is owned by the News & Observer newspaper. Please do not use or publish without permission from the N&O.,https://www.newsobserver.com/customer-service/copyright/,image;StillImage,image/jpeg,eng,,image,/objects/small/027_1963freedomforall_sm.jpg,/objects/thumbs/027_1963freedomforall_th.jpg
https://digital.ncdcr.gov/Documents/Detail/african-american-women-picketers-holding-signs-calling-for-justice./271323,blackhistory028,African American women picketers holding signs calling for justice.,1960,n,"News and observer (Raleigh, N.C.)",,African American women picketers holding signs calling for justice.,single-page; photograph,African Americans--Civil rights; Civil rights demonstrations--North Carolina; Civil rights movements--North Carolina--History--20th century; North Carolina--Race relations--History--20th century; North Carolina--Social conditions--20th century,,,,,State Archives of North Carolina,News and Observer Photograph Collection. Audio Visual Materials. State Archives of North Carolina,,,NO_2_10_1960_Sit_DownStrikeWoolworths_Fr21,Image copyright is owned by the News & Observer newspaper. Please do not use or publish without permission from the N&O.,https://www.newsobserver.com/customer-service/copyright/,image;StillImage,image/jpeg,eng,,image,/objects/small/028_1960womenpicketers_sm.jpg,/objects/thumbs/028_1960womenpicketers_th.jpg
https://digital.ncdcr.gov/Documents/Detail/african-americans-picketing-sir-walter-hotel/271284,blackhistory029,African Americans picketing Sir Walter Hotel,1963,n,"News and observer (Raleigh, N.C.)",,African Americans picketing Sir Walter Hotel,single-page; photograph,African Americans--Civil rights; Civil rights demonstrations--North Carolina; Civil rights movements--North Carolina--History--20th century; North Carolina--Race relations--History--20th century; North Carolina--Social conditions--20th century,"Raleigh, North Carolina",35.775389,-78.639583,,State Archives of North Carolina,News and Observer Photograph Collection. Audio Visual Materials. State Archives of North Carolina,,,NO_05_15_1963_Fr_39_Negroes_Picket_Church,Image copyright is owned by the News & Observer newspaper. Please do not use or publish without permission from the N&O.,https://www.newsobserver.com/customer-service/copyright/,image;StillImage,image/jpeg,eng,,image,/objects/small/029_1963sirwalterhotelpicketers_sm.jpg,/objects/thumbs/029_1963sirwalterhotelpicketers_th.jpg
https://digital.ncdcr.gov/Documents/Detail/a-group-of-african-american-protesters-chanting-and-clapping-on-the-lawn-of-the-executive-mansion-in-raleigh/271377,blackhistory030,A group of African American protesters chanting and clapping on the lawn of the Executive Mansion in Raleigh,1963,n,"News and observer (Raleigh, N.C.)",,A group of African American protesters chanting and clapping on the lawn of the Executive Mansion in Raleigh,single-page; photograph,African Americans--Civil rights; Civil rights demonstrations--North Carolina; Civil rights movements--North Carolina--History--20th century; North Carolina--Race relations--History--20th century; North Carolina--Social conditions--20th century,"Raleigh, North Carolina",35.78306,-78.635278,,State Archives of North Carolina,News and Observer Photograph Collection. Audio Visual Materials. State Archives of North Carolina,,,NO_5_13_1963_Protest_at_Governors_Mansion,Image copyright is owned by the News & Observer newspaper. Please do not use or publish without permission from the N&O.,https://www.newsobserver.com/customer-service/copyright/,Image;StillImage,image/jpeg,eng,,image,/objects/small/030_1963protestgovernorsmansion_sm.jpg,/objects/thumbs/030_1963protestgovernorsmansion_th.jpg
https://digital.ncdcr.gov/Documents/Detail/african-american-men-protesters-crowded-into-a-jail-cell/271368,blackhistory031,African American men protesters crowded into a jail cell,1963,n,"News and observer (Raleigh, N.C.)",,African American men protesters crowded into a jail cell,single-page; photograph,Civil rights movements--North Carolina--History--20th century; African Americans--Civil rights; North Carolina--Social conditions--20th century; North Carolina--Race relations--History--20th century; Civil rights demonstrations--North Carolina; Jails,,,,,State Archives of North Carolina,News and Observer Photograph Collection. Audio Visual Materials. State Archives of North Carolina,,,NO_5_11_1963_NegroesArrested_Fr19,Image copyright is owned by the News & Observer newspaper. Please do not use or publish without permission from the N&O.,https://www.newsobserver.com/customer-service/copyright/,Image;StillImage,image/jpeg,eng,,image,/objects/small/031_men_jail_sm.jpg,/objects/thumbs/031_men_jail_th.jpg
https://digital.ncdcr.gov/Documents/Detail/african-american-children-line-up-outside-of-albemarle-region-bookmobile/47212,blackhistory032,African-American children line up outside of Albemarle Region bookmobile,,,,,African-American children line up outside of Albemarle Region bookmobile,single-page; photograph,Albemarle Regional Library; Minorities--North Carolina; Women--North Carolina; Children--North Carolina; African Americans--North Carolina; Bookmobiles--North Carolina; Public libraries--North Carolina,"Albemarle, NC",,,,State Archives of North Carolina,Transforming the Tar Heel State: The Legacy of Public Libraries in North Carolina,,,tts_albemarle_photo_0007.tif,"Users are responsible for determining the legal status of and securing any permissions necessary to distribute, reproduce, or make other use of this item.",https://digital.ncdcr.gov/about#copyright-and-use-restrictions-simple-rich-text-area,Image;StillImage,image/jpeg,eng,,image,/objects/small/032_bookmobile_sm.jpg,/objects/thumbs/032_bookmobile_th.jpg
https://digital.ncdcr.gov/Documents/Detail/new-homemakers-of-america-activities-vocational-conference-photographs/64699,blackhistory033,New Homemakers of America: Activities--Vocational Conference--Photographs,1929-1984,y,North Carolina. Department of Public Instruction.,,"Photograph from a vocational conference. Future Homemakers of America collection, 1929-1984, includes correspondence, reports, news clippings, lists of officers, audits, programs, budgets, photographs, and other records on the history of Future Homemakers of America, New Homemakers of America, and Home Economics Related Occupations. New Homemakers of America, a club for African Americans, merged with Future Homemakers of America when school segregation ended.",multiple-page; photographs,African American girls; African Americans; African Americans--Segregation; Future Homemakers of America; Home demonstration work; Home economics--Study and teaching; Home economics--United States; Home economics--United States--History; Home economics--Vocational guidance; North Carolina Future Homemakers of America; Segregation; Women--Vocational guidance,"North Carolina, United States",,,,State Archives of North Carolina,Future Homemakers Associations,,SR.104.304,SR_DPI_DVE_FHA_B10F13_NHA_Vocational_Conf_Photos,The SA of NC considers this item in the public domain by U.S. law but responsibility for permissions rests with researchers.,https://digital.ncdcr.gov/about#copyright-and-use-restrictions-simple-rich-text-area,Image;StillImage,image/jpeg,eng,,image,/objects/small/033_nha_vocational_sm.jpg,/objects/thumbs/033_nha_vocational_th.jpg
https://digital.ncdcr.gov/Documents/Detail/new-homemakers-of-america-history-photographs-unidentified/82112,blackhistory034,New Homemakers of America: History--Photographs--Unidentified,1929-1984,y,North Carolina. Department of Public Instruction.,,"Unidentified photographs. Future Homemakers of America collection, 1929-1984, includes correspondence, reports, news clippings, lists of officers, audits, programs, budgets, photographs, and other records on the history of Future Homemakers of America, New Homemakers of America, and Home Economics Related Occupations. New Homemakers of America, a club for African Americans, merged with Future Homemakers of America when school segregation ended.",multiple-page; photographs,African American girls; African Americans; African Americans--Segregation; Future Homemakers of America; Home demonstration work; Home economics--Study and teaching; Home economics--United States; Home economics--United States--History; Home economics--Vocational guidance; North Carolina Future Homemakers of America; Segregation; Women--Vocational guidance,"North Carolina, United States",,,,State Archives of North Carolina,North Carolina. Department of Public Instruction.,,SR.104.304,SR_DPI_DVE_FHA_B9F10_NHA_History_Photos,The SA of NC considers this item in the public domain by U.S. law but responsibility for permissions rests with researchers.,https://digital.ncdcr.gov/about#copyright-and-use-restrictions-simple-rich-text-area,Image;StillImage,image/jpeg,eng,,image,/objects/small/034_nha_history_sm.jpg,/objects/thumbs/034_nha_history_th.jpg
https://digital.ncdcr.gov/Documents/Detail/state-supervisor-of-elementary-education-jeanes-miscellaneous-1910-1911-1933-1934-1952-1953/1119246?item=1119248,blackhistory035,"State Supervisor of Elementary Education: Jeanes, Miscellaneous, 1910, 1911, 1933, 1934, 1952, 1953",1910-1953,y,North Carolina. Department of Public Instruction.,,"These papers include correspondence, newsletters, reports, statistics, programs, and a photograph. Subjects include the Jeanes Fund, Jeanes teachers, teaching requirements, school visits, and issues in schools. The State Supervisor of Elementary Education in the Division of Negro Education travelled the state monitoring the quality of African American elementary schools, conducting meetings with school staff, organizing funding, and teaching demonstration classes.",multiple-page; photograph; letters,African Americans--Education; African Americans--Education (Higher); African Americans--Education--History; Education--North Carolina; Schools; Teachers,"Grambling, Louisiana; Raleigh, North Carolina",,,,State Archives of North Carolina,North Carolina. Department of Public Instruction.,,104.343,SR_DPI_DNE_ElemEd_Box5_Folder6,The SA of NC considers this item in the public domain by U.S. law but responsibility for permissions rests with researchers.,https://digital.ncdcr.gov/about#copyright-and-use-restrictions-simple-rich-text-area,Text,text/html,eng,,pdf,/objects/small/035_elemedjeanes_sm.jpg,/objects/thumbs/035_elemedjeanes_th.jpg
https://digital.ncdcr.gov/Documents/Detail/professor-jacobs-school-early-1900s/758176,blackhistory036,"Professor Jacob's School, early 1900s",1900,n,,,"Professor Jacob's School, African-American, students and teacher in front of school, early 1900's, Lake Waccamaw, NC, Columbus County. From the General Negative Collection, North Carolina State Archives, Raleigh, NC.",single-page; photograph,African Americans; African Americans--Education--North Carolina; African Americans--North Carolina--History,"Lake Waccamaw, North Carolina",34.285998,-78.505164,,State Archives of North Carolina,General Negative Collection. Audio Visual and Iconographic Materials. State Archives of North Carolina,,4.1.16.40 (Folder),N_89_1_71_ProfessorJacobsSchool,The SA of NC considers this item in the public domain by U.S. law but responsibility for permissions rests with researchers.,https://digital.ncdcr.gov/about#copyright-and-use-restrictions-simple-rich-text-area,Image;StillImage,image/jpeg,eng,,image,/objects/small/036_professorjacobsschool_sm.jpg,/objects/thumbs/036_professorjacobsschool_th.jpg
https://www.ncpedia.org/african-american-newspapers-north-carolina,blackhistory037,African American Newspapers in North Carolina,1827-present,y,"Gregory, Lisa",,Article about African American newspapers,single-page; article,African Americans; African Americans--North Carolina--History,,,,,NCpedia,State Library of NC.,,,/node/53241,"NCpedia content has been made available by contributors for personal educational use, consistent with provisions of fair use under copyright law. For any other uses, derivatives or republication requests, please contact the individual contributors or publishers.",https://www.ncpedia.org/writing-and-citing-ncpedia-articles,Text,text/html,eng,,pdf,/objects/small/037_black_newspapers_sm.jpg,/objects/thumbs/037_black_newspapers_th.jpg
https://digital.ncdcr.gov/Documents/Detail/photograph-rosenwald-fund-schoolhouse-unknown-location/974031,blackhistory038,"Photograph: Rosenwald Fund Schoolhouse, Unknown location",1900-1929,y,North Carolina. Department of Public Instruction.,,"Photograph, of an unknown Rosenwald Fund schoolhouse.",single-page; photograph,African Americans--Education; African Americans--Education--North Carolina; Education--North Carolina; Julius Rosenwald Fund; Julius Rosenwald Fund--Buildings; Schools,Unknown,,,,State Archives of North Carolina,Division of Negro Education: Special Subject File. Public Instruction Records. State Archives of North Carolina,,104.339,SR_DPI_DivNegroEdu_SpecialSubjectFile_Box8_RosenwaldFund_Photographs_034,The SA of NC considers this item in the public domain by U.S. law but responsibility for permissions rests with researchers.,https://digital.ncdcr.gov/about#copyright-and-use-restrictions-simple-rich-text-area,Image;StillImage,image/jpeg,eng,,image,/objects/small/038_rosenwaldschool34_sm.jpg,/objects/thumbs/038_rosenwaldschool34_th.jpg
https://digital.ncdcr.gov/Documents/Detail/photograph-the-old-johns-scotland-county-schoolhouse/974172,blackhistory039,"Photograph: the ""Old"" Johns, Scotland County Schoolhouse",1900-1929,y,North Carolina. Department of Public Instruction.,,"Photograph: the ""Old"" Johns, Scotland County Schoolhouse",single-page; photograph,African Americans--Education; African Americans--Education--North Carolina; Education--North Carolina; Julius Rosenwald Fund; Julius Rosenwald Fund--Buildings; Schools,"Johns, Scotland County, North Carolina",34.738494,-79.4914377,,State Archives of North Carolina,Division of Negro Education: Special Subject File. Public Instruction Records. State Archives of North Carolina,,104.339,SR_DPI_DivNegroEdu_SpecialSubjectFile_Box8_RosenwaldFund_Photographs_ScotlandCounty_04,The SA of NC considers this item in the public domain by U.S. law but responsibility for permissions rests with researchers.,https://digital.ncdcr.gov/about#copyright-and-use-restrictions-simple-rich-text-area,Image;StillImage,image/jpeg,eng,,image,/objects/small/039_rosenwaldschool43_sm.jpg,/objects/thumbs/039_rosenwaldschool43_th.jpg
https://www.ncpedia.org/anchor/african-american-involvement-wwi,blackhistory040,African American Involvement in World War I,1914-1918,y,"Davis, Sarajanee",,Article about African American soldiers who contributed to the war effort during World War I.,,African Americans; African Americans--North Carolina--History,,,,,ANCHOR,State Library of NC.,,,/node/31601,"NCpedia content has been made available by contributors for personal educational use, consistent with provisions of fair use under copyright law. For any other uses, derivatives or republication requests, please contact the individual contributors or publishers.",https://www.ncpedia.org/writing-and-citing-ncpedia-articles,Text,text/html,eng,,pdf,/objects/small/040_aa_wwi_sm.jpg,/objects/thumbs/040_aa_wwi_th.jpg
https://digital.ncdcr.gov/Documents/Detail/photograph-rosenwald-fund-schoolhouse-located-in-southern-pines-north-carolina/974135,blackhistory041,"Photograph: Rosenwald Fund Schoolhouse, Located in Southern Pines, North Carolina",1900-1929,y,North Carolina. Department of Public Instruction.,,"A photograph of a Rosenwald Fund schoolhouse built in Southern Pines, North Carolina.",single-page; photograph,African Americans--Education; African Americans--Education--North Carolina; Education--North Carolina; Julius Rosenwald Fund; Julius Rosenwald Fund--Buildings; Schools,"Southern Pines, North Carolina",35.174365,-79.397442,,State Archives of North Carolina,Division of Negro Education: Special Subject File. Public Instruction Records. State Archives of North Carolina,,104.339,SR_DPI_DivNegroEdu_SpecialSubjectFile_Box8_RosenwaldFund_Photographs_MooreCounty,The SA of NC considers this item in the public domain by U.S. law but responsibility for permissions rests with researchers.,https://digital.ncdcr.gov/about#copyright-and-use-restrictions-simple-rich-text-area,Image;StillImage,image/jpeg,eng,,image,/objects/small/041_rosenwaldschool54_sm.jpg,/objects/thumbs/041_rosenwaldschool54_th.jpg
https://www.ncpedia.org/anchor/thomas-peters-black-loyalist,blackhistory042,"Thomas Peters, Black Loyalist and African Nationalist",1738-1792,y,"Morrow, Megan",,An article about loyalist Thomas Peters,single-page; article,African Americans; African Americans--North Carolina--History,,,,,ANCHOR,State Library of NC.,,,/node/31571,"NCpedia content has been made available by contributors for personal educational use, consistent with provisions of fair use under copyright law. For any other uses, derivatives or republication requests, please contact the individual contributors or publishers.",https://www.ncpedia.org/writing-and-citing-ncpedia-articles,Text,text/html,eng,,pdf,/objects/small/042_thomaspeters_sm.jpg,/objects/thumbs/042_thomaspeters_th.jpg
https://digital.ncdcr.gov/Documents/Detail/general-correspondence-of-the-director-lumberton-school-strike-july-1946-june-1947/1061552,blackhistory043,"General Correspondence of the Director, Lumberton School Strike, July 1946 - June 1947",1946-1947,y,North Carolina. Department of Public Instruction.,,"Correspondence to and from Nathan Carter Newbold's office, the Director of the Division of Negro Education for the North Carolina State Department of Public Instruction from 1913 to 1950. The folder contains correspondence and newspaper clippings on the Lumberton School Strike, a protest against poor conditions within the two designated African American schools in Lumberton, North Carolina.",multiple-page; newspaper clippings; letters,African Americans--Education; African Americans--Education--History; African Americans--Education--North Carolina; Education--North Carolina; Rosenwald Schools; Schools,"Lumberton, North Carolina; Raleigh, North Carolina",,,,State Archives of North Carolina,Division of Negro Education: General Correspondence of the Director. Public Instruction Records. State Archives of North Carolina,,104.335,SR_DPI_DNE_Direc_Corr_Box16_Folder11,The SA of NC considers this item in the public domain by U.S. law but responsibility for permissions rests with researchers.,https://digital.ncdcr.gov/about#copyright-and-use-restrictions-simple-rich-text-area,Text,text/html,eng,,pdf,/objects/small/043_lumbertonnews_sm.jpg,/objects/thumbs/043_lumbertonnews_th.jpg
https://digital.ncdcr.gov/Documents/Detail/chief-justice-cheri-beasley-interview-2019-07-25-she.oh.011/1941383,blackhistory044,"Chief Justice Cheri Beasley Interview, 2019-07-25 [SHE.OH.011]",1966-,y,"Beasley, Cheri",,"Oral history interview with Cheri Beasley (b. 1966), the first Black female Chief Justice of the North Carolina Supreme Court. Interview conducted on July 25, 2019.",recording; audio,Admission to the bar; Appellate courts; Court administration; District courts; Judges; Judges--United States; Law schools; North Carolina. Supreme Court; Public defenders; Race discrimination; Women judges; Women's colleges,"Colorado, United States; Cumberland County, North Carolina; Research Triangle Park, North Carolina; Tennessee, United States; Wake County, North Carolina",,,,Internet Archive. State Archives of North Carolina.,She Changed the World Oral History Collection. State Archives of North Carolina,,SHE.OH.011,SHEOH_011,All rights for this interview held by State Archives of North Carolina. Contact Archives Registrar for permissions or publication information.,https://digital.ncdcr.gov/about#copyright-and-use-restrictions-simple-rich-text-area,Sound,audio/wav,eng,,audio,,
https://digital.ncdcr.gov/Documents/Detail/delores-dee-todd-interview-2019-06-10-she.oh.009/1941380,blackhistory045,"DeLores (Dee) Todd Interview, 2019-06-10 [SHE.OH.009]",1948-,y,"Todd, Delores",,"Oral history interview with DeLores """"Dee"""" Todd (b. 1948), the first African-American female Assistant Commissioner of the ACC, and the first African-American woman to appear on a cereal box, among other career feats. Interview conducted on June 10, 2019.",recording; audio,African American athletic directors; African American women track and field athletes; College sports--Coaching; Olympics; Race discrimination; Women athletes; Women track and field athletes,"Atlanta, Georgia; Chicago, Illinois; Washington, District of Columbia, United States",,,,Internet Archive. State Archives of North Carolina.,She Changed the World Oral History Collection. State Archives of North Carolina,,SHE.OH.009,SHEOH_009,All rights for this interview held by State Archives of North Carolina. Contact Archives Registrar for permissions or publication information.,https://digital.ncdcr.gov/about#copyright-and-use-restrictions-simple-rich-text-area,Sound,audio/wav,eng,,audio,,
